{
  "$schema": "https://json-schema.org/draft/2020-12/schema",
  "$id": "https://prototype-kits.local/schemas/factory-lock.schema.json",
  "title": "Prototype Kits · Registry Governance Lock",
  "description": "Kits 仓自己的治理锁：这一棵树现在属于哪个 registry 版本、哪次 commit、由哪一版策略管理、哪些文件是受管面。锁不是「最新状态」，是「采纳策略那一刻的快照」——所以它记的是 SHA 而不是 HEAD。\n\n**这份 schema 是一份本地扩展，而且是显式的扩展，不是一份被伪造的 product 锁。** 根控制面的 `contracts/factory-lock.schema.json` 目前用 `oneOf` 只描述两种形态：`factory-baseline`（基线自己的治理锁）与 product lock（从基线派生的产品）。Kits **两种都不是**：它不是从 Factory 基线派生的产品（没有 init-contract.json，也没有 baseline 身份），它是 provider / registry 的来源仓。\n\n所以这里没有把 `kind` 写成 `product` 去套一个不成立的形态 —— 那会让「这个仓是什么」变成一句假话，而假的元数据比缺的元数据更贵。本文件改为如实声明第三种形态 `kits-registry`，并把「根契约尚未支持这一形态」作为一条 unresolved 记录留在 `factory.lock.json` 里，交给控制面一侧扩 schema。\n\n**为什么这里不用 `oneOf`：**本仓的校验器（`scripts/lib/agent-policy.mjs`）不实现组合关键字，遇到 `oneOf` 会直接报错而不是静默跳过。一份「校验器读不懂于是当作满足」的 schema，正是这套门禁要防的失败模式。所以本 schema 只描述**一种**形态，严格且平铺。"
  ,
  "type": "object",
  "additionalProperties": false,
  "required": [
    "schemaVersion",
    "kind",
    "registry",
    "policy",
    "managedSurfaces",
    "unresolved",
    "note"
  ],
  "properties": {
    "$schema": { "type": "string" },
    "schemaVersion": { "const": 1 },
    "kind": {
      "enum": ["kits-registry"],
      "description": "这份锁描述的是 registry 的**来源仓**本身。它既不是 factory-baseline（基线自己），也不是 product（派生出的产品）。"
    },
    "registry": {
      "type": "object",
      "additionalProperties": false,
      "required": ["packageName", "version", "commit", "recordedOn"],
      "description": "被锁定的 registry 身份。`commit` 是采纳策略那一刻本仓 HEAD 的 SHA，不是「当前 HEAD」。",
      "properties": {
        "packageName": {
          "type": "string",
          "minLength": 1,
          "description": "必须等于本仓 package.json 的 name（prototype-kits）。Gate 每次都核。"
        },
        "version": {
          "type": "string",
          "pattern": "^\\d+\\.\\d+\\.\\d+$",
          "description": "被锁定的 registry 版本，读自 package.json 的 version。必须等于本仓 package.json 的 version——registry 版本就是分发契约的版本。"
        },
        "commit": {
          "type": "string",
          "pattern": "^[0-9a-f]{40}$",
          "description": "采纳策略时本仓 HEAD 的 40 位 SHA。HEAD 之后前进是正常的，锁不会因此失效——但必须能说出它是哪一次。"
        },
        "recordedOn": {
          "type": "string",
          "pattern": "^\\d{4}-\\d{2}-\\d{2}$",
          "description": "记录日期（YYYY-MM-DD）。"
        }
      }
    },
    "policy": {
      "type": "object",
      "additionalProperties": false,
      "required": ["version"],
      "properties": {
        "version": {
          "const": "1.3.0",
          "description": "与 factory-policy.json 的 policyVersion 必须一致。"
        }
      }
    },
    "managedSurfaces": {
      "type": "array",
      "minItems": 1,
      "description": "受本策略管理的文件（相对仓库根）。校验器要求每一个都真实存在——列一个不存在的路径等于没有管理它。",
      "items": { "type": "string", "minLength": 1 }
    },
    "unresolved": {
      "type": "array",
      "description": "**未知不猜。** 任何不能核实的外部事实都必须落在这里：`value` 只能是 null，`probe` 写清楚怎么核的、什么结果。把猜测写成事实，比留空更危险。",
      "items": {
        "type": "object",
        "additionalProperties": false,
        "required": ["id", "what", "why", "probe", "checkedOn", "value"],
        "properties": {
          "id": { "type": "string", "minLength": 1 },
          "what": { "type": "string", "minLength": 1 },
          "why": { "type": "string", "minLength": 1 },
          "probe": {
            "type": "string",
            "minLength": 1,
            "description": "实际执行的核实动作与它返回的东西。"
          },
          "checkedOn": { "type": "string", "pattern": "^\\d{4}-\\d{2}-\\d{2}$" },
          "value": {
            "type": "null",
            "description": "恒为 null：无法核实就是无法核实，这里不允许出现猜出来的值。"
          }
        }
      }
    },
    "note": { "type": "string", "minLength": 1 }
  }
}
