{
  "$schema": "./lib/factory-lock.schema.json",
  "schemaVersion": 1,
  "kind": "kits-registry",
  "registry": {
    "packageName": "prototype-kits",
    "version": "0.2.0",
    "commit": "a282c51b6828e8c8f22cd9b90022caca6328a0df",
    "recordedOn": "2026-09-15"
  },
  "policy": {
    "version": "1.3.0"
  },
  "managedSurfaces": [
    ".github/workflows/ci.yml",
    ".qa/qa.config.mjs",
    ".qa/qa-server.mjs",
    "factory-policy.json",
    "factory.lock.json",
    "lib/factory-lock.schema.json",
    "lib/factory-policy.schema.json",
    "scripts/check-qa-port.mjs",
    "scripts/guard-agent-policy.mjs",
    "scripts/lib/agent-policy.mjs"
  ],
  "unresolved": [
    {
      "id": "upstream/control-repo",
      "what": "skillre/prototype-factory-control 的 reusable workflow 尚无已验证的不可变 release ref",
      "why": "控制仓与 workflow 已发布，但本仓继续使用自包含 CI；切换前必须先验证不可变 commit/tag 和真实 Actions run。尚不存在的 @v1 不能写进 uses。",
      "probe": "2026-09-16 已核实控制仓远端 main 含 a3b069b 与 83916bf，且 .github/workflows/reusable-prototype-ci.yml 可读取；控制仓尚无 v1 tag，本仓 CI 当前未调用外部 workflow。",
      "checkedOn": "2026-09-16",
      "value": null
    }
  ],
  "note": "Kits 仓自己的治理锁，记录采纳 policy 1.3.0 那一刻的事实。registry.commit 是采纳开始时本仓 HEAD（main @ a282c51），不是当前 HEAD。身份是 registry 来源仓，不是 Factory baseline 或 product；本仓没有 init-contract.json。lib/factory-lock.schema.json 是本地单角色 schema。根控制仓 contracts/factory-lock.schema.json 已在 83916bf 加入 kits-registry role branch，并对本锁实测通过。控制仓 catalog 会在本轮收尾刷新 lock 与端口事实。"
}
